type,title,abstract,date,startTime,endTime,room,
Chalk talk,Best practices for building flexible architectures across Regions [REPEAT],"As AWS continues to open new Regions worldwide, you may find yourself considering whether to migrate workloads from existing Regions or to expand your product offerings to new geographic areas. Whether you aim to improve application latency, meet evolving compliance standards, optimize costs, or tap into new markets, adopting a flexible architecture across Regions can unlock a world of opportunities. This informative chalk talk will guide you through best practices for building a flexible cloud infrastructure that can seamlessly operate across multiple AWS Regions.",12/2/24,13:00,14:00,Caesars Forum | Level 1 | Academy 411,6
Chalk talk,Effectively model costs for your serverless applications [REPEAT],"In this chalk talk, gain insights into modeling the cost of serverless applications on AWS. Learn how traditional approaches based on CPU, memory, storage, and networking costs don’t directly apply. Discover how to holistically model costs for distributed serverless architectures by considering request loads, payload sizes, and service pricing. Walk through an example serverless application architecture, and leave with practical knowledge for accurately estimating costs tailored to modern, serverless application designs.",12/2/24,16:00,17:00,Caesars Forum | Level 1 | Academy 411,7
Chalk talk,Optimize performance and cost for archival data in Amazon S3,"Amazon S3 storage classes deliver the best price-performance object storage and are uniquely architected to deliver industry-leading functionality. In this chalk talk, learn how to analyze data access frequencies with native S3 tools, optimize archival storage using the S3 Glacier storage classes, and automate storage cost savings with S3 Lifecycle policies and S3 Intelligent-Tiering. Also explore how to get the best price-performance and integrate data restore processes into applications when designing and implementing archival restore workflows for data in the S3 Glacier storage classes, including through the use of S3 Batch Operations to make restores even faster and S3 Event Notifications to increase process efficiency. ",12/2/24,13:30,14:30,Caesars Forum | Level 1 | Academy 414,4
Chalk talk,A capability-oriented approach to defining your cloud architecture [REPEAT],"When you’re architecting workloads, you have a choice of over 200 AWS services. However, it doesn’t have to be overwhelming to pick the right services for your architecture. By defining your workload in terms of the capabilities required by your system, a combination of functional and nonfunctional requirements, you can simplify your choices. By defining your system’s important differentiating characteristics, you will find yourself naturally aligning the right AWS services to the capabilities required by your system. In this chalk talk, learn how to organize your system by capabilities and discover the architectural characteristics to pick the right services for those capabilities.",12/2/24,15:00,16:00,Caesars Forum | Level 1 | Alliance 305,1
Lightning talk,A proactive approach to secrets management at scale,"Keep your secrets to yourself. Whether it’s AWS access keys with over-privileged permissions or database passwords hardcoded into your applications, compromised credentials are the most common technique threat actors use to gain unintended access to applications and sensitive data. In this lightning talk, learn strategies you can implement to identify and vault secrets early in the software development lifecycle. Then, explore how you can use vaulted secrets without exposing them. Hear best practices, and discover both traditional and generative AI–based approaches to secrets management.",12/4/24,12:00,12:20,Venetian | Hall B | Expo | Theater 5,
Builders' Fair,A visual guessing game using generative AI [REPEAT],"Come play the generative AI drawing game where a human sketches and AI guesses. Powered by Amazon Bedrock and LLMs, a human doodles objects and scenes on a whiteboard while the AI bot tries to guess what the doodle represents before the timer ends in order to access the next level. The AI bot utilizes previous guesses to inform its next guess, adapting based on feedback. This demonstrates the LLM’s ability to learn and understand visual inputs through an interactive game.",12/3/24,10:00,18:00,Venetian | Level 2 | Hall B | Expo | Booth #2034 | Project 15,
Builders' Fair,A visual guessing game using generative AI [REPEAT],"Come play the generative AI drawing game where a human sketches and AI guesses. Powered by Amazon Bedrock and LLMs, a human doodles objects and scenes on a whiteboard while the AI bot tries to guess what the doodle represents before the timer ends in order to access the next level. The AI bot utilizes previous guesses to inform its next guess, adapting based on feedback. This demonstrates the LLM’s ability to learn and understand visual inputs through an interactive game.",12/2/24,16:00,19:00,Venetian | Level 2 | Hall B | Expo | Booth #2034 | Project 15,
Chalk talk,Accelerating event-driven architecture with event storming [REPEAT],"Event-driven architectures are experiencing a renaissance. While getting started is not difficult, builders may encounter challenges on their journeys. Domain-driven design is a tool that can help, but many developers are unfamiliar with how to get started. In this chalk talk, learn about a general framework that uses domain-driven design to think through, design, and build cloud-native event-driven architectures.",12/2/24,10:30,11:30,Caesars Forum | Level 1 | Alliance 305,5
Code talk,Resilience solutions for cohesive application protection,"AWS services often have their own resiliency solutions. However, applications can span multiple AWS resources and creating a unified runbook for addressing business continuity events can be daunting. In this code talk, discover several common architectures comprising multiple AWS services resources and learn the best ways to create cohesive and simple resiliency plans.",12/5/24,12:30,13:30,Wynn | Convention Promenade | Margaux 1,4
Chalk talk,Building modern API architectures: Which front door should I use? [REPEAT],"Architects have a number of options for building modern APIs, including REST, GraphQL, and real-time APIs. In this chalk talk, explore these options along with their benefits and drawbacks. The talk then covers practical use cases that show how to implement each style of API on AWS, including using managed services such as Amazon API Gateway, AWS IoT, and AWS AppSync.",12/2/24,12:00,13:00,Caesars Forum | Level 1 | Alliance 305,4
Lightning talk,Accelerate Apache Spark up to 5 times on AWS with RAPIDS (sponsored by NVIDIA),"Accelerating batch ETL workloads with GPUs offers significant cost savings, improved performance, and reduced power consumption. In this lightning talk, explore how to enhance Apache Spark using Amazon EC2 G6 GPU instances, demonstrating speedups of up to five times and cost reductions of 80% on Spark operations. Learn strategies for utilizing GPUs in Spark batch ETL workloads on Amazon EMR, and discover a tool designed to identify workloads best suited for GPU acceleration. Hear success stories from RAPIDS Accelerator for Apache Spark users. Also learn about customer adoption journeys, production deployments, and the substantial cost and performance benefits users experience. This presentation is brought to you by NVIDIA, an AWS Partner.",N/A,N/A,N/A,N/A,
Chalk talk,"AWS Amplify: Integrating data sources, authentication & AWS services","Expand the capabilities of your full stack applications with the latest updates to AWS Amplify. In this chalk talk, explore how Amplify can seamlessly integrate with a wide range of existing data sources, authentication providers, and AWS infrastructure. Connect your Amplify-powered applications to PostgreSQL or MySQL databases, leveraging Amplify’s data modeling and API generation capabilities. Discover how to authenticate users with any OpenID Connect (OIDC) or SAML provider. Use the AWS CDK to customize Amplify resources, such as Amazon S3 buckets and Amazon DynamoDB tables, and to add custom AWS resources to your project.",12/2/24,16:30,17:30,Caesars Forum | Level 1 | Forum 126,1
Chalk talk,Fine-tune and deploy Llama 3.1 models on AWS Trainium and Inferentia,"AWS Neuron SDK allows you to train, fine-tune, and deploy foundation models on AWS Trainium and AWS Inferentia when building generative AI applications. This chalk talk provides an overview of Neuron SDK and the various capabilities that maximize performance and deliver ease-of-use when training and deploying Llama 3.1 models on AWS AI chips. Dive deep into Neuron Distributed libraries and discover debugging, profiling, and observability tools that can help you optimize performance of your AI workloads on AWS AI chips.",12/2/24,10:30,11:30,Caesars Forum | Level 1 | Forum 126,1
Lightning talk,Accelerate business and mission outcomes with AWS Government Regions,"In this lightning talk, learn how AWS Government Regions—AWS GovCloud (US), AWS Secret Region, and AWS Top Secret Regions—help customers accelerate their desired outcomes and the deployment of modern applications while reducing risk compared to legacy on-premises deployments. The AWS Government Regions are purpose-built, compliance-eligible, secure, and scalable cloud infrastructures designed to address mission needs and critical workload requirements for civilian, healthcare, and financial agencies, the US Intelligence Community, the Department of Defense, the defense industrial base, and technology partners and supporting organizations.",12/3/24,12:30,12:50,Venetian | Hall B | Expo | Theater 2,
Chalk talk,"Balancing resilience, security, and cost in cloud architecture","As organizations develop cloud infrastructure, they must balance resilience, security, and cost optimization in their architectures. This talk explores the complex relationships between these priorities, providing a framework for informed decision-making. Participants learn resilience strategies like multi-Region deployments; security measures for identity, access, and data protection; and cost optimization techniques using cost-effective services and resource utilization. Using real-world case studies, assess your organization's needs and make strategic architectural decisions that align with business objectives. By navigating the tradeoffs between resilience, security, and cost, learn to design reliable, secure, and cost-effective cloud systems.",12/2/24,13:00,14:00,Caesars Forum | Level 1 | Forum 132,5
Chalk talk,Best practices for migrating to Amazon OpenSearch Service [REPEAT],"Migrating to Amazon OpenSearch Service involves five main steps: plan, POC, deploy, data migration, and cutover. In this chalk talk, learn how to build a successful migration strategy to OpenSearch Service. Hear technical guidance on the key milestones in each migration step, starting with your premigration inventory up to your cutover stage. This talk also teaches you how to use Amazon OpenSearch Ingestion to accelerate your migration journey to OpenSearch Service.",12/2/24,16:00,17:00,Caesars Forum | Level 1 | Forum 132,1
Workshop,Accelerate development with AWS Lambda Powertools for serverless APIs,"In this workshop, start with an existing application built with Python and progressively improve your API event handler using Powertools for AWS Lambda. Learn how to implement request and response validation, dynamic routing, exception handling, middleware, and OpenAPI schema generation. Discover how to improve your API event handler with serverless best practices using Python that you can easily extend to other Powertools runtimes. You must bring your laptop to participate.",12/3/24,11:30,13:30,Mandalay Bay | Level 2 South | Oceanside A,
Builders' session,Accelerate FM pre-training on Amazon SageMaker HyperPod [REPEAT],"Amazon SageMaker HyperPod removes the undifferentiated heavy lifting involved in building and optimizing machine learning (ML) infrastructure for training foundation models (FMs), reducing training time by up to 40%. In this builders’ session, learn how to pre-train a large language model (LLM) using Slurm on SageMaker HyperPod. Explore the model pre-training workflow from start to finish, including setting up clusters, troubleshooting convergence issues, and running distributed training to improve model performance. You must bring your laptop to participate.",12/2/24,14:30,15:30,Mandalay Bay | Level 2 South | Surf B,
Builders' session,Accelerate FM pre-training on Amazon SageMaker HyperPod [REPEAT],"Amazon SageMaker HyperPod removes the undifferentiated heavy lifting involved in building and optimizing machine learning (ML) infrastructure for training foundation models (FMs), reducing training time by up to 40%. In this builders’ session, learn how to pre-train a large language model (LLM) using Slurm on SageMaker HyperPod. Explore the model pre-training workflow from start to finish, including setting up clusters, troubleshooting convergence issues, and running distributed training to improve model performance. You must bring your laptop to participate.",12/6/24,9:00,10:00,Caesars Forum | Level 1 | Summit 232 | Content Hub | Builder's 2,
Builders' session,Accelerate FM pre-training on Amazon SageMaker HyperPod [REPEAT],"Amazon SageMaker HyperPod removes the undifferentiated heavy lifting involved in building and optimizing machine learning (ML) infrastructure for training foundation models (FMs), reducing training time by up to 40%. In this builders’ session, learn how to pre-train a large language model (LLM) using Slurm on SageMaker HyperPod. Explore the model pre-training workflow from start to finish, including setting up clusters, troubleshooting convergence issues, and running distributed training to improve model performance. You must bring your laptop to participate.",12/4/24,14:30,15:30,Caesars Forum | Level 1 | Alliance 315,
Chalk talk,It all starts with DNS: Getting the best results from Amazon Route 53,"In this chalk talk, explore the key features of Amazon Route 53, the latest innovations, and the real-world use cases. Whether you’re focused on managing DNS records at scale, integrating with on-premises infrastructure, optimizing traffic flow through advanced routing policies, or enhancing the security of your DNS traffic, this talk provides you with the insights needed to get the most from Amazon Route 53.",12/2/24,13:00,14:00,Caesars Forum | Level 1 | Summit 220,3
Builders' session,Accelerate from monolith to modern developer platform with gen AI [REPEAT],"Traditional monolith applications are challenging to modernize, restricting the ability to innovate. Adding new functionality using cloud-native architecture and microservices helps organizations maximize resiliency, efficiency, and agility. This builders’ session showcases an end-to-end modernization journey. Learn how to onboard your development team quickly to AWS by abstracting the complexity of cloud-native architecture using generative AI and actionable blueprints available in a secure internal developer platform (IDP) using Backstage and Harmonix on AWS. Please be sure to have your free AWS Builder ID established before attending. You must bring your laptop to participate.",12/2/24,13:30,14:30,Caesars Forum | Level 1 | Alliance 311,
Builders' session,Accelerate from monolith to modern developer platform with gen AI [REPEAT],"Traditional monolith applications are challenging to modernize, restricting the ability to innovate. Adding new functionality using cloud-native architecture and microservices helps organizations maximize resiliency, efficiency, and agility. This builders’ session showcases an end-to-end modernization journey. Learn how to onboard your development team quickly to AWS by abstracting the complexity of cloud-native architecture using generative AI and actionable blueprints available in a secure internal developer platform (IDP) using Backstage and Harmonix on AWS. Please be sure to have your free AWS Builder ID established before attending. You must bring your laptop to participate.",12/6/24,8:30,9:30,Caesars Forum | Level 1 | Alliance 315,
Chalk talk,"Always on, always available with AWS resilience lifecycle framework","Customers expect an always-on, always-available experience. In this chalk talk, explore strategies to minimize downtime and enable customer-facing applications to withstand unexpected failures or to quickly recover from them. Discover practical guidance on using the resilience lifecycle framework to build resilient applications on AWS. Learn actionable techniques to architect robust, fault-tolerant applications that deliver exceptional reliability for your customers. This chalk talk is intended for AWS Partners.",12/2/24,9:00,10:00,Caesars Forum | Level 1 | Summit 221,2
Chalk talk,"Amazon EKS: Infrastructure as code, GitOps, or CI/CD [REPEAT]","Discover various architectures to build and deploy workloads on Amazon EKS with Amazon ECR. When deploying workloads into a cluster, there are different secure software supply chain automation choices, including CI/CD pipelines, IaC tools like Terraform and CDK, and GitOps patterns with Argo CD. Hear how these options differ and fit together from the developer, architect, and operations perspectives, and learn how to choose options depending on team structure and skills. Explore how to adopt, mix, and match DevOps and GitOps based on different design factors, and learn about the design factors for developer, architect, and operations perspectives.",12/2/24,16:30,17:30,Caesars Forum | Level 1 | Summit 221,1
Chalk talk,Build serverless streaming data pipelines for real-time analytics,"Streaming data is unbounded, generated at scale, and needs to be processed within seconds for real-time analytics. This presents unique design challenges for scale and cost efficiency. In this chalk talk, learn how to deliver real-time streams, including database CDC streams into Amazon S3, Apache Iceberg, or Amazon Redshift using AWS serverless services like Amazon Data Firehose, Amazon Kinesis Data Streams, and Amazon MSK Serverless. Through well-architected solutions and demos, gain insights into processing data at scale and optimizing operating costs.",12/2/24,13:00,14:00,Mandalay Bay | Level 2 South | Lagoon G,2
Chalk talk,Accelerate innovation with AWS AI/ML services,"AWS AI/ML services like Amazon Bedrock, Amazon Kendra, Amazon Textract, and Amazon SageMaker Canvas offer game-changing opportunities for new users. These tools enable businesses to extract insights from data, automate processes, and enhance decision-making. With a wide range of services and connectors, users can easily access data from various sources, including Amazon S3, databases, and on-premises storage. By leveraging these AI/ML services, new AWS users can drive innovation, streamline operations, and gain a competitive edge. From automating document processing to enhancing search capabilities and building custom ML models, these services provide comprehensive, scalable solutions for businesses embracing AI/ML technologies.",12/2/24,10:30,11:30,Mandalay Bay | Level 3 South | South Seas D,1
Chalk talk,Embed seamless customer support with Amazon Connect [REPEAT],"Delivering exceptional customer service and support is challenging, as they demand attention across numerous touch points, like physical products, product documentation, and mobile customer support apps. This chalk talk explores specific strategies for elevating your customer experience with Amazon Connect. Learn how to create a cohesive, frictionless support experience using techniques like embedded channels, proactive outreach, and out-of-the-box information sharing that will delight your customers. ",12/2/24,14:30,15:30,Mandalay Bay | Lower Level North | South Pacific B,4
Lightning talk,Accelerate growth: Strategies for new customer engagement and expansion,"In this lightning talk, we will share the recipe for driving exponential customer growth by leveraging the synergies between AWS and partners, covering a range of AWS-partner tactics proven effective for attracting, engaging, and converting new customers at scale. Key strategies include go-to-market (GTM) activities focused on new customer acquisition, developing the right point-of-entry solutions, and co-selling aligned to the AWS GTM strategy. By harnessing the combined power of AWS and partner capabilities, organizations can stay ahead of the curve and cement their position as industry leaders. This talk is intended for AWS Partners.",12/4/24,13:30,13:50,Venetian | Hall B | Expo | Theater 1,
Chalk talk,Best practices for observability [REPEAT],"Achieving comprehensive observability by ensuring optimal performance, reliability, and user experience is crucial for businesses. In this interactive chalk talk, explore best practices for collecting and analyzing metrics, traces, and logs across your AWS environments. Discover techniques for streamlining agent management, optimizing alerting, and enabling cross-account observability. Learn how to reduce operational overhead while gaining deeper visibility into your applications' performance and health—all in a cost-optimized manner.",12/2/24,16:30,17:30,Mandalay Bay | Lower Level North | South Pacific D,5
Chalk talk,Operational excellence: Best practices for resilient systems [REPEAT],"In this chalk talk, learn how operational practices such as logging, health checks, and safe deployment affect the resilience of well-architected applications. Explore use cases demonstrating potential implications of poor operational practices on system availability and analyze these use cases in line with well-architected principles. Learn about improvement strategies and best practices to enhance the resilience of your AWS architecture. Session goals include understanding how different operational practices can affect the resilience of well-architected applications, exploring and analyzing different use cases impacting resiliency with AWS experts; and learning about operational best practices in line with well-architected principles to improve resilience of your AWS architecture.",12/2/24,9:00,10:00,MGM | Level 1 | 105,4
Workshop,Accelerate innovation capabilities with generative AI and mechanisms,"In today’s rapidly evolving tech landscape, navigating complex innovation and transformation initiatives can be daunting. This hands-on workshop equips you with the tools and strategies to unlock your organization’s full potential for innovation and transformation. Use the AWS Innovation Pulse Check tool, powered by generative AI, to assess capabilities and receive tailored recommendations. Explore mental models that empower informed decision-making and foster an innovation culture. Dive into interactive modules to review processes, design effective change mechanisms, and prioritize actions for exceptional customer value delivery. Walk away with a roadmap to accelerate innovation maturity and stay ahead in the tech landscape. You must bring your laptop to participate.",12/4/24,8:30,10:30,MGM | Level 3 | Premier 312,
Chalk talk,How event-driven architectures can go wrong and how to fix them [REPEAT],"Event-driven architectures enable speed and agility for distributed cloud applications; however, this also means there’s the risk of shipping bad ideas fast without governance. Fortunately, the same agility allows for quick fixes. Attend this chalk talk to learn common event-driven pitfalls, including YOLO events, god events, observability soup, event loops, exposing monoliths, state corruption, and surprise bills. Explore strategies and techniques teams can implement to avoid these pitfalls and reap the full benefits of event-driven architectures.",12/2/24,15:00,16:00,MGM | Level 1 | Boulevard 156,2
Lightning talk,Accelerate insurance transformation using gen AI and data analytics (sponsored by DXC Technology),"The insurance industry has traditionally evolved deliberately and cautiously. However, insurers now face evolving regulatory requirements, changing customer expectations, and increased claim severity and frequency that require broader and faster digital-led transformation. In this lightning talk, learn how insurers are turning to the cloud to more quickly create new and better products for changing customer demand, offer personalized engagements across high-impact agent and low-cost digital interactions, and automate internal processes for improved efficiencies. This presentation is brought to you by DXC Technology, an AWS Partner.",12/4/24,14:00,14:20,Venetian | Hall B | Expo | Theater 4,
Workshop,Accelerate mainframe modernization at scale with generative AI,"Explore how generative AI capabilities with AWS Mainframe Modernization Automated Refactor with AWS Blu Age accelerate mainframe modernization while seamlessly integrating with your current tools, processes, and team's expertise. In this workshop, learn how to use generative AI to discover code summaries, explanations, and user screen design previews; analyze assisted classification; and transform both supported and unsupported legacy source code to build and deploy new Java applications to the AWS Mainframe Modernization service. You must bring your laptop to participate.",12/5/24,15:00,17:00,MGM | Level 1 | Grand 113,
