type,title,abstract,date,startTime,endTime,room,
Interactive training,Boost LLM capabilities with a vector database using Amazon OpenSearch,"In this new interactive training session powered by generative AI, address a simulated business scenario by implementing a self-service recommendation tool using customer input. Explore how semantic search, Retrieval Augmented Generation (RAG), and Large Language Models (LLMs) can enhance conversational AI. Leverage Amazon OpenSearch Service as an embedding vector database and deploy pretrained LLMs with Amazon SageMaker. Use SageMaker Studio for the machine learning tasks. A laptop is required for this session.",12/5/24,11:00,12:30,Mandalay Bay | Level 2 South | Mandalay Bay Ballroom C,
Workshop,Boost your Kubernetes journey with EKS Blueprints for CDK & Amazon Q [REPEAT],"Bootstrapping and operating Kubernetes environments can be complex, from selecting the right open source tools to implementing multi-tenancy and security controls. In this hands-on workshop, learn how to use Amazon EKS Blueprints for CDK, a collection of infrastructure-as-code modules, to rapidly provision and configure an Amazon EKS cluster for a microservices application. Discover how Amazon Q can assist you in writing and modifying the AWS CDK code to streamline infrastructure provisioning. Learn how to deploy and configure a ready-to-use Amazon EKS cluster using continuous deployment automation, allowing you to scale the provisioning and maintenance of Amazon EKS clusters across your organization efficiently. You must bring your laptop to participate.",12/5/24,15:30,17:30,Caesars Forum | Level 1 | Summit 216,
Workshop,Boost your Kubernetes journey with EKS Blueprints for CDK & Amazon Q [REPEAT],"Bootstrapping and operating Kubernetes environments can be complex, from selecting the right open source tools to implementing multi-tenancy and security controls. In this hands-on workshop, learn how to use Amazon EKS Blueprints for CDK, a collection of infrastructure-as-code modules, to rapidly provision and configure an Amazon EKS cluster for a microservices application. Discover how Amazon Q can assist you in writing and modifying the AWS CDK code to streamline infrastructure provisioning. Learn how to deploy and configure a ready-to-use Amazon EKS cluster using continuous deployment automation, allowing you to scale the provisioning and maintenance of Amazon EKS clusters across your organization efficiently. You must bring your laptop to participate.",12/2/24,8:00,10:00,Wynn | Upper Convention Promenade | Cristal  1,
Builders' session,Boosting member participation through enhanced digital experiences,"Donor engagement and retention are critical objectives for nonprofit organizations. Consistently engaging donors through personalized gratitude communications and emphasizing the impact of donor gifts are effective methods in enhancing donor experience. In this builders’ session, discover how AWS machine learning and generative AI services can help you implement targeted and personalized messages. Leave this session with hands-on experience using AWS AI services that can help you enhance campaign effectiveness, and ultimately, build a stronger connection with your donors. You must bring your laptop to participate.",12/3/24,11:30,12:30,MGM | Level 3 | 350,
Builders' Fair,Bot-ticelli: Robotic sketch artist [REPEAT],"Bot-ticelli is a robotic artist capable of sketching a human face. It is a combination of technologies (generative AI and robotics) and showcases how they can be combined on AWS. The robot works with a camera that takes a frontal shot of a human and runs it through a generative AI pipeline (SDXL and ControlNet) to generate a sketch image. The sketch is converted to G-code instruction for a robotic arm, which is rendered on paper. Walk away with a robot-drawn portrait, signed by Bot-ticelli.",12/2/24,16:00,19:00,Venetian | Level 2 | Hall B | Expo | Booth #2034 | Project 14,
Builders' Fair,Bot-ticelli: Robotic sketch artist [REPEAT],"Bot-ticelli is a robotic artist capable of sketching a human face. It is a combination of technologies (generative AI and robotics) and showcases how they can be combined on AWS. The robot works with a camera that takes a frontal shot of a human and runs it through a generative AI pipeline (SDXL and ControlNet) to generate a sketch image. The sketch is converted to G-code instruction for a robotic arm, which is rendered on paper. Walk away with a robot-drawn portrait, signed by Bot-ticelli.",12/3/24,10:00,18:00,Venetian | Level 2 | Hall B | Expo | Booth #2034 | Project 14,
Workshop,Build & deploy an enterprise-grade app in two hours with AWS App Studio,"Dive deep and get hands-on experience with AWS App Studio to build a complex, multistep purchase order approval application that extracts information from an uploaded PDF and then summarizes and evaluates the content using AI capabilities. In this workshop, learn about the high-level architecture, and build this application in small groups, experiencing firsthand the power of App Studio in rapidly developing enterprise-ready applications. You must bring your laptop to participate.",12/4/24,12:30,14:30,Caesars Forum | Level 1 | Alliance 307,
Workshop,Build & deploy an enterprise-grade app in two hours with AWS App Studio,"Dive deep and get hands-on experience with AWS App Studio to build a complex, multistep purchase order approval application that extracts information from an uploaded PDF and then summarizes and evaluates the content using AI capabilities. In this workshop, learn about the high-level architecture, and build this application in small groups, experiencing firsthand the power of App Studio in rapidly developing enterprise-ready applications. You must bring your laptop to participate.",12/2/24,8:00,10:00,Mandalay Bay | Lower Level North | Islander C,
Interactive training,Build & evaluate RAG applications using Amazon Bedrock Knowledge Bases,"In this Amazon Bedrock lab, build and evaluate efficient, enterprise-ready, question-answering applications. Use Retrieval Augmented Generation (RAG) techniques to combine large language models with external knowledge retrieval systems. Also, learn the Ragas framework to evaluate the generated responses on metrics such as faithfulness, answer relevancy, and context precision. Workstations are provided for you; no laptop required.",12/3/24,11:30,13:00,Mandalay Bay | Level 2 South | Lagoon L,
Lightning talk,Build a culture of efficiency and innovation in your organization,"Generative AI has the potential to not only unlock new efficiencies and business outcomes for customers but also deliver new levels of efficiency and innovation in your organization. In this lightning talk, hear how AWS Partners can leverage AWS generative AI offerings internally to drive business value. This talk is intended for AWS Partners.",12/5/24,14:00,14:20,Venetian | Hall B | Expo | Theater 1,
Interactive training,Build a custom model using Amazon SageMaker Canvas,"In this Amazon SageMaker lab, learn how to build and run a machine learning model with no code using Amazon SageMaker Canvas. Use sample data to train models, compare their performance, and make predictions.",12/4/24,12:00,13:30,Mandalay Bay | Level 2 South | Lagoon L,
Workshop,Build a data mesh using AWS Transfer Family and AWS Lake Formation,"Discover how data mesh architectures revolutionize product offerings while centralizing security, governance, auditing, and data discovery. In this workshop, learn how AWS Transfer Family can automate the data processing pipeline for third-party data, validate the integrity of files transferred, apply PGP encryption and decryption and anti-malware scans, and load the data into a secure data mesh integrated with AWS Lake Formation. Assume the role of data scientist, and query your data with traditional tools like Amazon Athena. Then use Amazon Q Business to gain additional insights and Amazon Q in QuickSight to pull reports. You must bring your laptop to participate.",12/2/24,8:00,10:00,Mandalay Bay | Level 2 South | Oceanside A,
Builders' session,Build a financial assistant with Amazon Q and Amazon Bedrock Agents,"Financial institutions manage complex, document-intensive workflows to perform financial analysis and reporting. In this session, build an assistant that enhances financial document processing and improves productivity using multimodal large language model (LLM) capabilities and a knowledge base built with Amazon Q. Also, learn how to use Amazon Bedrock Agents to create a single view for financial analysis on documents, structured content, and APIs. This approach can help you interact with these data sources, summarize financial statements, and generate prospectus documents including charts and data tables. You must bring your laptop to participate.",12/3/24,14:30,15:30,Wynn | Convention Promenade | Latour 7,
Workshop,Build a gen AI application using knowledge graphs in Amazon Neptune,"In this workshop, build an application to query your domain-specific, differentiated, and highly related datasets using natural language. Amazon Neptune is your database of record storing a knowledge graph with the most up-to-date version of your data and helps the LLM at the center of your application improve the quality of the answers provided. Discover how to use multimodal inputs, such as text, images, or both, for a Retrieval Augmented Generation (RAG) process that uses vector search over your knowledge graph data. You must bring a laptop to participate.",12/2/24,15:00,17:00,MGM | Level 3 | Premier 312,
Builders' session,Build a generative AI agentic workflow for customer self-service,"This builders’ session showcases how generative AI services like Amazon Bedrock, Amazon SageMaker, and Amazon OpenSearch Service can revolutionize customer self-service and automated troubleshooting. Learn to build personalized customer journeys using real-time data, and explore constructing generative AI workflows using knowledge bases and machine learning (ML) algorithms to resolve issues autonomously. A live demo will highlight these AI-driven solutions’ potential for enhanced customer engagement, efficiency, and proactive issue resolution. You must bring your laptop to participate.",12/4/24,10:30,11:30,MGM | Level 3 | 353,
Workshop,Build a generative AI industrial diagnosis & troubleshooting assistant,"In this workshop, construct a generative AI–powered assistant that enhances operational efficiency and reduces machine downtime in industrial settings. While harnessing the power of large language models from Amazon Bedrock, learn how to integrate AWS IoT SiteWise and an enterprise knowledge graph, and find out how to connect knowledge bases, configure agents, and establish robust guardrails. When finished, see your generative AI assistant in action in a simulated factory environment and the impact it makes to deliver contextualized insights and actionable recommendations to plant operators. You must bring your laptop to participate.",12/4/24,12:30,14:30,Caesars Forum | Level 1 | Summit 228,
Builders' session,Build a Generative BI chatbot with LangGraph and Amazon Bedrock,"In this builders’ session, use generative AI technologies to build an analytics chatbot that integrates Amazon Bedrock large language models (LLMs) and multi-actor LLM orchestration. Learn about all the components necessary to build an analytical chatbot leveraging production-grade and scalable AWS services. Attendees build an easy-to-use, intelligent system that will allow end users to ask analytical questions from tabular data stored in Amazon Redshift. You must bring your laptop to participate.",12/5/24,11:00,12:00,MGM | Level 1 | Terrace 151,
Interactive training,Build a product recommendation engine using Amazon Neptune,"In this lab, learn how to model your source data from relational databases and document stores to Amazon Neptune in order to meet this business need. Use a sample customer order database to build a product recommendation system that is used to send real-time product recommendations to customers as they browse the products portal.",12/3/24,15:45,17:15,Mandalay Bay | Level 2 South | Lagoon L,
Workshop,Build a scalable cross-platform multiplayer game backend on AWS [REPEAT],"In this workshop, learn how to use the AWS Game Backend Framework to develop a custom cross-platform game backend for your multiplayer game. Explore cross-platform player identity, backend microservices for matchmaking, and integrations to popular game engines. Also learn how to use Amazon GameLift to host your game servers globally, close to players for a low-latency real-time experience. You must bring your laptop to participate.",12/5/24,12:30,14:30,Wynn | Convention Promenade | Margaux 2,
Workshop,Build a scalable cross-platform multiplayer game backend on AWS [REPEAT],"In this workshop, learn how to use the AWS Game Backend Framework to develop a custom cross-platform game backend for your multiplayer game. Explore cross-platform player identity, backend microservices for matchmaking, and integrations to popular game engines. Also learn how to use Amazon GameLift to host your game servers globally, close to players for a low-latency real-time experience. You must bring your laptop to participate.",12/2/24,12:30,14:30,Wynn | Convention Promenade | Margaux 2,
Builders' session,Build a secure GraphQL with AWS AppSync [REPEAT],"In this session, attendees learn how to use AWS Amplify Studio and AWS AppSync to build a secure and scalable GraphQL API. Start by exploring the benefits of a GraphQL-based architecture and how it can simplify application development. Then dive into a working session where participants create their own GraphQL API, configure authentication and authorization, and deploy it into production in your account. You must bring your laptop to participate.",12/3/24,17:30,18:30,Caesars Forum | Level 1 | Summit 232 | Content Hub | Builder's 1,
Builders' session,Build a secure GraphQL with AWS AppSync [REPEAT],"In this session, attendees learn how to use AWS Amplify Studio and AWS AppSync to build a secure and scalable GraphQL API. Start by exploring the benefits of a GraphQL-based architecture and how it can simplify application development. Then dive into a working session where participants create their own GraphQL API, configure authentication and authorization, and deploy it into production in your account. You must bring your laptop to participate.",12/2/24,13:00,14:00,Caesars Forum | Level 1 | Alliance 315,
Interactive training,Build a serverless chatbot using Amazon Bedrock to perform RAG ,"In this new interactive training session powered by generative AI, address a simulated business scenario and build an AI chatbot that taps into a knowledge base to provide customers with detailed, contextual information. Leverage AWS services like Amazon Bedrock and Amazon Kendra to index data and enable Retrieval Augmented Generation (RAG). Integrate Amazon serverless services for efficient application code execution. A laptop is required for this session.",12/5/24,13:00,14:30,Mandalay Bay | Level 2 South | Mandalay Bay Ballroom A,
Builders' session,"Build a serverless, real-time API for a generative AI–powered chatbot","In this hands-on builders' session, build a serverless, real-time chat experience with a virtual assistant. Dive deep into serverless, real-time APIs powered by AWS AppSync, AWS Lambda, and Amazon Bedrock. Explore how to leverage these APIs to build cutting-edge generative AI applications. Leave with practical skills for building scalable, cost-effective, real-time APIs that seamlessly integrate your generative AI models. Gain firsthand experience constructing an immersive chat experience enhanced by AI capabilities. You must bring your laptop to participate.",12/3/24,16:00,17:00,Caesars Forum | Level 1 | Summit 232 | Content Hub | Builder's 1,
Builders' session,Build a unified namespace and connect factories at scale,"This hands-on builders’ session guides you through the process of connecting Siemens PLCs at scale, determining the exposed data, and generating an AWS IoT SiteWise hierarchy using generative AI with Amazon Bedrock. Learn how to take exposed data from a brownfield PLC; create an ISA-95-compliant asset hierarchy using AWS IoT SiteWise, AWS IoT Greengrass, and Amazon Bedrock; and build a dashboard displaying live data. This session offers a step-by-step, practical approach to mastering the skills needed to build a unified namespace and connecting a factory at scale. You must bring your laptop to participate.",12/4/24,12:00,13:00,MGM | Level 3 | 353,
Builders' session,Build a vehicle insights assistant with AWS IoT and Amazon Q [REPEAT],"In this interactive session, use AWS IoT to ingest vehicle data and then use Amazon Q to build a conversational generative AI–powered assistant that helps analyze the data using natural language queries and responses. Ask questions about the data like “Which vehicles have a low battery charge?” or “What are average vehicle speeds in the morning versus evening?” Learn how you can use Amazon Q to explore advanced querying and analysis capabilities like filtering, aggregations, and anomaly detection, and discover how Amazon Q can help you fine-tune your data collection campaigns or maintenance schedules based on collected data. You must bring your laptop to participate.",12/3/24,13:00,14:00,Wynn | Convention Promenade | Latour 7,
Builders' session,Build a vehicle insights assistant with AWS IoT and Amazon Q [REPEAT],"In this interactive session, use AWS IoT to ingest vehicle data and then use Amazon Q to build a conversational generative AI–powered assistant that helps analyze the data using natural language queries and responses. Ask questions about the data like “Which vehicles have a low battery charge?” or “What are average vehicle speeds in the morning versus evening?” Learn how you can use Amazon Q to explore advanced querying and analysis capabilities like filtering, aggregations, and anomaly detection, and discover how Amazon Q can help you fine-tune your data collection campaigns or maintenance schedules based on collected data. You must bring your laptop to participate.",12/5/24,15:30,16:30,Wynn | Convention Promenade | Latour 7,
Builders' session,Build a vehicle insights assistant with AWS IoT and Amazon Q [REPEAT],"In this interactive session, use AWS IoT to ingest vehicle data and then use Amazon Q to build a conversational generative AI–powered assistant that helps analyze the data using natural language queries and responses. Ask questions about the data like “Which vehicles have a low battery charge?” or “What are average vehicle speeds in the morning versus evening?” Learn how you can use Amazon Q to explore advanced querying and analysis capabilities like filtering, aggregations, and anomaly detection, and discover how Amazon Q can help you fine-tune your data collection campaigns or maintenance schedules based on collected data. You must bring your laptop to participate.",12/2/24,9:00,10:00,Wynn | Level 1 | Lafite 4 | Content Hub | Builder's 1,
Builders' session,Build a vehicle insights assistant with AWS IoT and Amazon Q [REPEAT],"In this interactive session, use AWS IoT to ingest vehicle data and then use Amazon Q to build a conversational generative AI–powered assistant that helps analyze the data using natural language queries and responses. Ask questions about the data like “Which vehicles have a low battery charge?” or “What are average vehicle speeds in the morning versus evening?” Learn how you can use Amazon Q to explore advanced querying and analysis capabilities like filtering, aggregations, and anomaly detection, and discover how Amazon Q can help you fine-tune your data collection campaigns or maintenance schedules based on collected data. You must bring your laptop to participate.",12/5/24,12:30,13:30,Wynn | Convention Promenade | Latour 7,
Workshop,Build a video generator with AI/ML tools in Amazon SageMaker Studio,"In this workshop, get hands-on experience building an Automated Video Highlight Reel Generator using Amazon SageMaker’s comprehensive tools. Learn to search for and select the right multi-modal LLM for video use cases. Interactively build a multi-modal image/video analysis engine that automatically highlights the most exciting parts of any video using Amazon SageMaker Studio notebooks. Perfect your highlight reel generation system by fine-tuning your multi-modal LLM with custom text-image/video pairs using SageMaker training jobs. Finally, deploy your fine-tuned model as a SageMaker-hosted endpoint. Also learn to deploy a low-latency, production-ready Streamlit app UI on AWS. You must bring your laptop to participate.",12/4/24,15:30,17:30,Mandalay Bay | Lower Level North | Islander C,
Workshop,Build a web-scale application with purpose-built databases & analytics [REPEAT],"In this workshop, learn to build modern web applications at scale using purpose-built databases. Discover how to apply development patterns using Amazon Aurora, Amazon DynamoDB, Amazon ElastiCache, Amazon Neptune, and Amazon OpenSearch Service to build a fully functional and scalable bookstore ecommerce application, and dive deep into best practices along the way. Basic familiarity with AWS concepts and services such as AWS Identity and Access Management (IAM), Amazon VPC, networking, and storage services is recommended. You must bring your laptop to participate.",12/2/24,8:00,10:00,MGM | Level 3 | Premier 315,
Workshop,Build a web-scale application with purpose-built databases & analytics [REPEAT],"In this workshop, learn to build modern web applications at scale using purpose-built databases. Discover how to apply development patterns using Amazon Aurora, Amazon DynamoDB, Amazon ElastiCache, Amazon Neptune, and Amazon OpenSearch Service to build a fully functional and scalable bookstore ecommerce application, and dive deep into best practices along the way. Basic familiarity with AWS concepts and services such as AWS Identity and Access Management (IAM), Amazon VPC, networking, and storage services is recommended. You must bring your laptop to participate.",12/5/24,12:30,14:30,Mandalay Bay | Lower Level North | Islander I,
Workshop,Build agentic workflows with Amazon Bedrock and open source frameworks,"In this immersive workshop, learn how to build scalable and intelligent agentic workflows using Amazon Bedrock, LangChain, and LangGraph. Through hands-on coding, use Amazon Bedrock capabilities with LangChain to process and generate text, images, and data, enabling autonomous agents that understand natural language instructions. Then, discover how to use the Amazon Bedrock Converse API to build conversational AI agents for streamlined customer service. Finally, integrate Amazon Bedrock with LangGraph to create multistep, AI-powered workflows that adapt to business requirements by connecting conversational agents and data processing capabilities developed throughout the workshop. You must bring your laptop to participate.",12/4/24,15:30,17:30,Caesars Forum | Level 1 | Alliance 307,
Workshop,Build an AI-powered media and asset management system,"In this workshop, build an AI-powered media and asset management system using various AI-powered AWS services and learn how to unlock valuable information from video, audio, pictures, and documents using these services. You must bring your laptop to participate.",12/2/24,12:00,14:00,MGM | Level 1 | Grand 123,
Builders' session,Build an app using AWS App Studio. No development expertise required.,"In this builders’ session, learn how to integrate powerful generative AI capabilities into your AWS App Studio application. In minutes, you’ll have an app integrated with your SSO that performs powerful, intelligent operations without needing software development expertise nor being an AI/ML practitioner. You must bring your laptop to participate.",12/3/24,16:30,17:30,Mandalay Bay | Level 2 South | Surf E,
Interactive training,Build and deploy tools using LLM agents with Amazon Bedrock,"In this new interactive training session powered by generative AI, address a simulated business scenario by creating a customer service bot with real-time data integration, using AWS Lambda and Amazon RDS for up-to-date personalization and improved customer interactions. Configure the agent so that Amazon Bedrock can interact with organizational data and user queries. You must bring your laptop to participate.",12/5/24,11:00,12:30,Mandalay Bay | Level 2 South | Mandalay Bay Ballroom A,
Community activities,Build and Give Back,"Join AWS in supporting local nonprofits in Las Vegas, Nevada, by participating in activities such as building dynamo lights or packing first aid kits at our Build and Give Back location in the Expo. ",12/4/24,10:00,18:00,Venetian | Level 2 | Hall B | Community & Impact Pavilion | Build & Give Back,
Community activities,Build and Give Back,"Join AWS in supporting local nonprofits in Las Vegas, Nevada, by participating in activities such as building dynamo lights or packing first aid kits at our Build and Give Back location in the Expo. ",12/2/24,16:00,19:00,Venetian | Level 2 | Hall B | Community & Impact Pavilion | Build & Give Back,
Community activities,Build and Give Back,Stop by Build and Give Back in the Impact and Community Pavilion in the expo to #GiveBack to AWS local nonprofits and Amazon disaster relief efforts.,12/5/24,10:00,16:00,Venetian | Level 2 | Hall B | Community & Impact Pavilion | Build & Give Back,
Community activities,Build and Give Back,Stop by Build and Give Back in the Impact and Community Pavilion in the expo to #GiveBack to AWS local nonprofits and Amazon disaster relief efforts.,12/3/24,10:00,18:00,Venetian | Level 2 | Hall B | Community & Impact Pavilion | Build & Give Back,
