type,title,abstract,date,startTime,endTime,room,
Workshop,Optimize FMs with AWS purpose-built accelerators for industry apps,"Join this workshop to learn how to use AWS purpose-built accelerators and Amazon SageMaker to optimize FMs from Hugging Face for real-world industry use cases. Learn how to effectively utilize AWS purpose-built accelerators to train the models, enabling more efficient deployment and inference on a sample platform. This workshop also focuses on cost optimization and ROI from utilizing these accelerators for training and inference. You must bring your laptop to participate. This workshop is intended for AWS Partners.",12/4/24,9:00,11:00,Venetian | Level 3 | Lido 3006,
Workshop,Optimize virtual desktop performance with enhanced observability [REPEAT],"You can’t effectively manage it if you don’t measure it. Powerful observability functionality included with Amazon WorkSpaces Family services helps you monitor, troubleshoot, and maximize the performance of your fleet. Attend this workshop to get hands-on experience using advanced features like threshold alarms, automatic notifications, and metrics on latency, CPU performance, and memory usage to optimize end user experience and overall fleet performance. You must bring your laptop to participate.",12/5/24,12:00,14:00,MGM | Level 1 | Grand 117,
Workshop,Optimize virtual desktop performance with enhanced observability [REPEAT],"You can’t effectively manage it if you don’t measure it. Powerful observability functionality included with Amazon WorkSpaces Family services helps you monitor, troubleshoot, and maximize the performance of your fleet. Attend this workshop to get hands-on experience using advanced features like threshold alarms, automatic notifications, and metrics on latency, CPU performance, and memory usage to optimize end user experience and overall fleet performance. You must bring your laptop to participate.",12/5/24,15:00,17:00,MGM | Level 1 | Grand 123,
Workshop,Optimize virtual desktop performance with enhanced observability [REPEAT],"You can’t effectively manage it if you don’t measure it. Powerful observability functionality included with Amazon WorkSpaces Family services helps you monitor, troubleshoot, and maximize the performance of your fleet. Attend this workshop to get hands-on experience using advanced features like threshold alarms, automatic notifications, and metrics on latency, CPU performance, and memory usage to optimize end user experience and overall fleet performance. You must bring your laptop to participate.",12/3/24,12:30,14:30,MGM | Level 3 | Premier 311,
Lightning talk,Optimize your AWS Marketplace listings for better conversions,"Is your AWS Marketplace listing optimized to drive conversions? Learn about best practices that new and existing sellers can use to optimize their AWS Marketplace product listings. In this lightning talk, get an overview of features and strategies that you can use to help your buyers more easily discover and evaluate your products. Learn about AWS Marketplace features that you can utilize to help accelerate customer time-to-value, including standard contracts, vendor insights, free trials, and more. This talk is intended for AWS Partners.",12/4/24,12:30,12:50,Venetian | Hall B | Expo | Theater 1,
Builders' session,Optimize your AWS Marketplace spend with Amazon Q in QuickSight [REPEAT],"In this builders’ session, explore how to optimize your AWS Marketplace spend through data-driven cost analysis and control. Implement granular tags, detailed usage reports, and cost allocation tagging. Use Amazon Q in QuickSight to build visualizations and gain insights to reduce waste and inform better decisions. With provided demo accounts, analyze sample data, examine reports, and visualize key metrics using Amazon Q’s natural language capabilities. Leave this session equipped to monitor, allocate, and optimize your AWS Marketplace costs through robust tagging strategies, proactive usage analysis, enhanced cost allocation, and flexible visualizations powered by Amazon Q in QuickSight. You must bring your laptop to participate.",12/2/24,17:30,18:30,Caesars Forum | Level 1 | Alliance 315,
Builders' session,Optimize your AWS Marketplace spend with Amazon Q in QuickSight [REPEAT],"In this builders’ session, explore how to optimize your AWS Marketplace spend through data-driven cost analysis and control. Implement granular tags, detailed usage reports, and cost allocation tagging. Use Amazon Q in QuickSight to build visualizations and gain insights to reduce waste and inform better decisions. With provided demo accounts, analyze sample data, examine reports, and visualize key metrics using Amazon Q’s natural language capabilities. Leave this session equipped to monitor, allocate, and optimize your AWS Marketplace costs through robust tagging strategies, proactive usage analysis, enhanced cost allocation, and flexible visualizations powered by Amazon Q in QuickSight. You must bring your laptop to participate.",12/3/24,14:30,15:30,MGM | Level 1 | Terrace 151,
Builders' session,Optimize your AWS Marketplace spend with Amazon Q in QuickSight [REPEAT],"In this builders’ session, explore how to optimize your AWS Marketplace spend through data-driven cost analysis and control. Implement granular tags, detailed usage reports, and cost allocation tagging. Use Amazon Q in QuickSight to build visualizations and gain insights to reduce waste and inform better decisions. With provided demo accounts, analyze sample data, examine reports, and visualize key metrics using Amazon Q’s natural language capabilities. Leave this session equipped to monitor, allocate, and optimize your AWS Marketplace costs through robust tagging strategies, proactive usage analysis, enhanced cost allocation, and flexible visualizations powered by Amazon Q in QuickSight. You must bring your laptop to participate.",12/4/24,17:30,18:30,Caesars Forum | Level 1 | Summit 232 | Content Hub | Builder's 1,
Builders' session,Optimize your cloud investments using Amazon Bedrock,"Manually tracking the interconnected nature of deployed cloud resources and reviewing their utilization can be complex and time-consuming. In this builders’ session, see a demo on how you can optimize your cloud investments to maximize efficiency and cost-effectiveness. Explore a novel approach that harnesses AWS services like Amazon Bedrock, AWS CloudFormation, Amazon Neptune, and Amazon CloudWatch to analyze resource utilization and manage unused AWS resources. Using Amazon Bedrock, analyze the source code to identify the AWS resources used in the application. Apply this information to build a knowledge graph that represents the interconnected AWS resources. You must bring a laptop to participate.",12/5/24,14:30,15:30,Caesars Forum | Level 1 | Alliance 311,
Lightning talk,Optimizing AI workloads on Amazon Bedrock: A technical deep dive (sponsored by New Relic),"Join this technical lightning talk to explore optimizing AI workloads on Amazon Bedrock with New Relic AI Monitoring. Through live demos and real-world examples, learn to identify performance bottlenecks, troubleshoot issues, and optimize cost efficiency and scalability. Discover how New Relic’s unified platform enables seamless visibility across your AI stack for reliable and efficient deployments. This presentation is brought to you by New Relic, an AWS Partner.",12/4/24,14:30,14:50,Venetian | Hall B | Expo | Theater 5,
Lightning talk,Optimizing data workflows for AI with SnapLogic and AWS (sponsored by SnapLogic),"In this lightning talk, discover how to enhance your AI projects by streamlining data workflows through the integration of SnapLogic and AWS. Explore automated data preparation and cleansing techniques that ensure your data is always ready for analysis. Learn practical strategies for accelerating time to insight, minimizing manual effort, and ultimately, boosting the effectiveness and outcomes of your AI initiatives. This session is designed for data professionals seeking to optimize their workflows, making AI-driven insights more accessible and impactful. This presentation is brought to you by SnapLogic, an AWS Partner.",12/2/24,17:30,17:50,Venetian | Hall B | Expo | Theater 5,
Lightning talk,Optimizing generative AI workloads for sustainability [REPEAT],"With the increasing complexity, scale, and adoption of AI workloads, it is important to consider their environmental impact. This lightning talk provides environmental sustainability insights that are specific to large language models. Explore practical best practices for different customization scenarios, including training models from the beginning, fine-tuning with additional data using full or parameter-efficient techniques, Retrieval Augmented Generation, and prompt engineering.",12/5/24,14:30,14:50,Caesars Forum | Level 1 | Forum 115 Foyer,
Lightning talk,Optimizing generative AI workloads for sustainability [REPEAT],"With the increasing complexity, scale, and adoption of AI workloads, it is important to consider their environmental impact. This lightning talk provides environmental sustainability insights that are specific to large language models. Explore practical best practices for different customization scenarios, including training models from the beginning, fine-tuning with additional data using full or parameter-efficient techniques, Retrieval Augmented Generation, and prompt engineering.",12/3/24,14:30,14:50,Caesars Forum | Level 1 | Forum 115 Foyer,
Lightning talk,Optimizing production schedules for flexible manufacturing ,"In today's on-demand economy, custom parts manufacturers face complex challenges in meeting rapidly shifting customer requirements. They must navigate constraints around machine capabilities, material compatibility, maintenance schedules, and order fulfillment timeframes. Gaining comprehensive visibility into plant floor operations through real-time machine telemetry data is crucial. Enterprise-wide telemetry data enables shop-floor optimization analytics, providing a unified view of the production environment. In this lightning talk, learn how manufacturers can leverage AWS services to optimize production schedules, maximize machine utilization, minimize downtime, and efficiently fulfill a diverse mix of custom orders on time while being energy efficient.",12/5/24,10:30,10:50,Venetian | Hall B | Expo | Theater 2,
Builders' session,Orchestrate data and ML workflows with managed Apache Airflow [REPEAT],"Amazon Managed Workflows for Apache Airflow (Amazon MWAA) is a managed Apache Airflow service for orchestrating data processing and ML workflows. In this builders’ session, learn how Amazon MWAA simplifies managing and scaling the Airflow environment, and build Airflow DAGs to orchestrate and automate end-to-end data and ML processing workflows for ingestion, transformation, and consumption. You must bring your laptop to participate.",12/3/24,16:30,17:30,Caesars Forum | Level 1 | Alliance 311,
Builders' session,Orchestrate data and ML workflows with managed Apache Airflow [REPEAT],"Amazon Managed Workflows for Apache Airflow (Amazon MWAA) is a managed Apache Airflow service for orchestrating data processing and ML workflows. In this builders’ session, learn how Amazon MWAA simplifies managing and scaling the Airflow environment, and build Airflow DAGs to orchestrate and automate end-to-end data and ML processing workflows for ingestion, transformation, and consumption. You must bring your laptop to participate.",12/2/24,8:30,9:30,Caesars Forum | Level 1 | Alliance 315,
Builders' session,Orchestrate data and ML workflows with managed Apache Airflow [REPEAT],"Amazon Managed Workflows for Apache Airflow (Amazon MWAA) is a managed Apache Airflow service for orchestrating data processing and ML workflows. In this builders’ session, learn how Amazon MWAA simplifies managing and scaling the Airflow environment, and build Airflow DAGs to orchestrate and automate end-to-end data and ML processing workflows for ingestion, transformation, and consumption. You must bring your laptop to participate.",12/2/24,17:30,18:30,Caesars Forum | Level 1 | Summit 232 | Content Hub | Builder's 1,
Builders' session,Orchestrate data and ML workflows with managed Apache Airflow [REPEAT],"Amazon Managed Workflows for Apache Airflow (Amazon MWAA) is a managed Apache Airflow service for orchestrating data processing and ML workflows. In this builders’ session, learn how Amazon MWAA simplifies managing and scaling the Airflow environment, and build Airflow DAGs to orchestrate and automate end-to-end data and ML processing workflows for ingestion, transformation, and consumption. You must bring your laptop to participate.",12/3/24,13:30,14:30,Wynn | Level 1 | Lafite 4 | Content Hub | Builder's 1,
Builders' session,Outbound traffic inspection with AWS Cloud WAN & AWS Network Firewall [REPEAT],"AWS offers several managed networking services that help you more easily build, manage, and secure global networks. This builders’ session explores two of those managed services, AWS Cloud WAN and AWS Network Firewall, through the build-out of a solution that allows you to architect and implement outbound traffic controls. You must bring your laptop to participate.",12/2/24,12:00,13:00,Caesars Forum | Level 1 | Summit 232 | Content Hub | Builder's 2,
Builders' session,Outbound traffic inspection with AWS Cloud WAN & AWS Network Firewall [REPEAT],"AWS offers several managed networking services that help you more easily build, manage, and secure global networks. This builders’ session explores two of those managed services, AWS Cloud WAN and AWS Network Firewall, through the build-out of a solution that allows you to architect and implement outbound traffic controls. You must bring your laptop to participate.",12/2/24,8:30,9:30,Caesars Forum | Level 1 | Summit 232 | Content Hub | Builder's 1,
Builders' Fair,P3: Putting practice prototype with AI coaching [REPEAT],"Showcase your putting skills at re:Invent's P3 event! Our advanced computer vision models, powered by Amazon SageMaker, will track your every putt, capturing the motion of your putter, the ball, and your body. The AI-powered P3 Putting Coach will analyze this data, providing personalized feedback on your consistency, accuracy, and technique. Use these insights to refine your putting and take your game to new heights. Your performance will be scored based on successful putts, distance attempted, and stroke consistency. The top scorers earn a spot on the prestigious P3 Leaderboard, cementing their status as putting virtuosos.",12/4/24,10:00,18:00,Venetian | Level 2 | Hall B | Expo | Booth #2034 | Project 26,
Builders' Fair,P3: Putting practice prototype with AI coaching [REPEAT],"Showcase your putting skills at re:Invent's P3 event! Our advanced computer vision models, powered by Amazon SageMaker, will track your every putt, capturing the motion of your putter, the ball, and your body. The AI-powered P3 Putting Coach will analyze this data, providing personalized feedback on your consistency, accuracy, and technique. Use these insights to refine your putting and take your game to new heights. Your performance will be scored based on successful putts, distance attempted, and stroke consistency. The top scorers earn a spot on the prestigious P3 Leaderboard, cementing their status as putting virtuosos.",12/5/24,10:00,16:00,Venetian | Level 2 | Hall B | Expo | Booth #2034 | Project 26,
Workshop,Perform vector search on your Amazon DynamoDB data using zero-ETL,"In this workshop, learn how to set up Amazon DynamoDB zero-ETL integration with Amazon OpenSearch Service to add generative AI experiences to your DynamoDB-based applications. Create a pipeline from a DynamoDB table to OpenSearch Service, create an Amazon Bedrock ML connector in OpenSearch Service, and query Amazon Bedrock using OpenSearch Service as a vector store. Discover best practices to use your differentiated data stored in DynamoDB to support context-aware reasoning applications. You must bring your laptop to participate.",12/3/24,11:30,13:30,Caesars Forum | Level 1 | Alliance 307,
Workshop,Persona-based access to data for generative AI applications,"In this workshop, manage document access in a chatbot application tailored to various user roles within an organization. Learn how to address challenges around secure information distribution, enhancing efficiency and compliance by aligning access rights with job functions. Using Retrieval Augmented Generation (RAG), metadata filtering in Amazon Bedrock Knowledge Bases, and Amazon Cognito, this approach mitigates risk by restricting data exposure to authorized personnel. Learn how this architecture secures role-specific information retrieval, improves knowledge management in enterprise generative AI applications, and supports a safer data environment through engaging hands-on labs. You must bring your laptop to participate.",12/5/24,15:00,17:00,Venetian | Level 3 | Lido 3104,
Lightning talk,Physical climate risk assessment and analysis using AWS services [REPEAT],"Learn how to assess physical climate risk using AWS services. Physical climate risk assessment provides critical insights into the expected impacts of climate change to businesses, organizations, and communities. By using AWS solution and guidance, organizations can harness advanced climate models and datasets to generate actionable insights across their portfolios, operations, and supply chains with high fidelity and granularity.",12/2/24,10:30,10:50,Caesars Forum | Level 1 | Forum 115 Foyer,
Lightning talk,Physical climate risk assessment and analysis using AWS services [REPEAT],"Learn how to assess physical climate risk using AWS services. Physical climate risk assessment provides critical insights into the expected impacts of climate change to businesses, organizations, and communities. By using AWS solution and guidance, organizations can harness advanced climate models and datasets to generate actionable insights across their portfolios, operations, and supply chains with high fidelity and granularity.",12/3/24,15:30,15:50,Caesars Forum | Level 1 | Forum 115 Foyer,
Lightning talk,Pitching better: Workshop for founders to overcome bias in fundraising,"Join the AWS Startups Team for a tactical fundraising workshop. Research has found that women founders get asked more prevention questions (“Is this actually a large market opportunity?”) while men get asked more promotion questions (“How big can this business get?”). This workshop will be relevant for all underrepresented founders and cover 1) how to identify unconsciously biased questions, 2) ways to answer these questions, and 3) how to clarify and pivot. Research has showed that founders who answer questions using these tips are able to raise $7.4M more than founders who do not.",12/5/24,14:30,14:50,Venetian | Hall B | Expo | Theater 5,
Workshop,Pixel-perfect reporting and data visualization with Amazon QuickSight,"In this workshop, gain hands-on experience with data visualizations and pixel-perfect classic banded and prompted reports with Amazon QuickSight, using the Generative BI capabilities of Amazon Q. Learn best practices for programmatically generating highly formatted static and interactive reports, securing data access, and automating delivery of insights in various formats. Discover how consumers can schedule reports for automatic delivery. Develop the skills to create reports, dashboards, and visualizations in QuickSight, along with the understanding for how to leverage natural language with Amazon Q to boost your productivity. You must bring your laptop to participate.",12/4/24,13:00,15:00,Venetian | Level 3 | Lido 3006,
Dev chat,Platform engineering excellence: Strategy and technology,"Navigating the world of platform engineering is becoming increasingly complex. To ensure maximum impact for customers while minimizing disruption to downstream engineering teams, a range of strategic approaches and technical decisions is essential. By sharing real-world deliveries and use cases, this talk provides a comprehensive guide on how to maximize the effectiveness of platform engineering; details key considerations, pitfalls, and challenges; and highlights how leveraging AI can also boost developer productivity. By doing so, organizations can expect to deliver with short timeframes and with less impediments.",12/4/24,13:00,13:20,Venetian | Hall B | Expo | Theater 3,
Lightning talk,Platform engineers as product managers: Boost your team’s productivity (sponsored by Cortex),"Platform engineering is the backbone of engineering teams, but its true potential is unlocked with a product management mindset. In this lightning talk, hear the CTO and cofounder of Cortex.io explain how platform engineers can enhance their impact by treating their internal developer portal as a product. By understanding internal customers’ needs, prioritizing features, and ensuring a seamless developer experience, platform engineers can substantially increase their team’s productivity. Join us to discover how adopting this mindset can transform your platform engineering efforts into a high-impact, developer-centric initiative that empowers your teams and drives organizational success. This presentation is brought to you by Cortex, an AWS Partner.",12/4/24,14:30,14:50,Venetian | Hall B | Expo | Theater 3,
Builders' Fair,PokerVision: The ultimate poker mentor for players of all levels [REPEAT],"PokerVision offers an immersive AR poker experience, guiding players of all levels. Wear AR headsets or use your device to choose an avatar and witness poker analytics—winning odds, best hand, and cards needed to improve your hand. Powered by Amazon Bedrock, it calculates optimal moves and odds, acting as your strategic advisor. Join the revolution with PokerVision, a platform making poker accessible and engaging across all levels, mentoring you to poker proficiency.",12/5/24,10:00,16:00,Venetian | Level 2 | Hall B | Expo | Booth #2034 | Project 27,
Builders' Fair,PokerVision: The ultimate poker mentor for players of all levels [REPEAT],"PokerVision offers an immersive AR poker experience, guiding players of all levels. Wear AR headsets or use your device to choose an avatar and witness poker analytics—winning odds, best hand, and cards needed to improve your hand. Powered by Amazon Bedrock, it calculates optimal moves and odds, acting as your strategic advisor. Join the revolution with PokerVision, a platform making poker accessible and engaging across all levels, mentoring you to poker proficiency.",12/4/24,10:00,18:00,Venetian | Level 2 | Hall B | Expo | Booth #2034 | Project 27,
Lightning talk,Power up your customer experience with end-to-end data strategy,"Gain a comprehensive understanding of how to implement an end-to-end data strategy to drive customer-centric innovation. Learn practical strategies and techniques to collect, analyze, and act on data-driven insights that directly impact the customer journey. Key takeaways include: understanding the essential elements of an end-to-end data strategy, uncovering customer insights and acting on them, learning to optimize operations and deliver personalized experiences, gaining practical tools and techniques to elevate the customer experience, and becoming equipped to drive customer-centric innovation within your organization.",12/5/24,15:30,15:50,Venetian | Hall B | Expo | Theater 2,
Workshop,"Practical data protection, data privacy, and risk assessment","Navigating data privacy is a critical business requirement. This workshop takes a by-example approach to assessing and implementing controls to help you meet data privacy requirements. First, review the regulation, conduct a risk assessment, and select controls to mitigate those risks. Then, discuss deploying AWS services and features to help implement those controls and automate the generation of audit artifacts. Gain practical experience using AWS to simplify managing your risks and a toolbox you can implement in workloads to mitigate those risks. You must bring your laptop to participate.",12/2/24,8:30,10:30,MGM | Level 3 | Chairmans 368,
Workshop,Predictive maintenance with generative AI and agentic workflows,"In the era of Industry 4.0, predictive maintenance has become a cornerstone for enhancing operational efficiency and reducing downtime. Generative AI enhances predictive maintenance workflows by enabling real-time anomaly detection and actionable insights while facilitating natural language interactions and dynamic task execution through agentic workflows. During this workshop, learn how to use generative AI to detect anomalies in sensor readings from an electric motor by comparing them with the specifications in the motor's operating manual. When anomalies are detected, a large language model will utilize agents to determine who is on call and notify them of the issue. You must bring your laptop to participate.",12/4/24,8:30,10:30,Wynn | Convention Promenade | Mouton 2,
Workshop,Prepare your data for generative AI,"Generative AI applications need data from diverse data sources and, for an optimal experience, require the data to be reliable, trustworthy, and well-governed. Join this hands-on workshop to explore a robust data foundation on AWS for an end-to-end generative AI experience. Learn how to prepare your data for generative AI with batch and real-time data pipelines, high data quality, vector data management for custom needs, and integrated data governance. You must bring your laptop to participate.",12/3/24,16:30,18:30,MGM | Level 1 | Grand 117,
